en,cn,audio_url,meta,id
The book is considered to be a classic in literature.,这本书被认为是文学经典。,,,6005adfb-d673-4362-8a58-f981d750d79e
I prefer reading books to watching movies.,我更喜欢读书而不是看电影。,,,2a2c899c-f927-4959-aabf-78f6bdae10dd
She prefers walking to driving for short distances.,短距离她更喜欢步行而不是开车。,,,86f061cd-4f03-4972-a0cc-7421cc0ab9cf
He has suffered from heart disease for many years.,他患心脏病已经很多年了。,,,c9e5e808-b73f-4354-90af-7d08ff409303
Many people suffer from heart disease due to poor lifestyle choices.,许多人因不良生活方式而患有心脏病。,,,6775c012-4551-4c07-bd28-1875136cb809
I need to do over this painting because I made a mistake.,我需要重画这幅画，因为我犯了个错误。,,,602be85f-f4cd-457c-a7f6-559d9f9fb0b2
She decided to do over her essay to improve the grade.,她决定重写论文以提高分数。,,,44c5c1f1-4c40-4a10-930e-7607890e951f
The airline offers a saver fare for early bookings.,该航空公司为提前预订提供优惠票价。,,,c4e4ee7a-a210-4718-b096-ff0c0991cc77
I managed to get a saver fare for my trip to London.,我设法买到了去伦敦旅行的特价票。,,,49d05598-1639-4974-9dba-bc41216961c2
It's hard to keep up with the latest technology trends.,很难跟上最新的技术趋势。,,,3463b6cd-5337-47bc-a741-53ea906f8659
She runs fast to keep up with her friends.,她跑得很快以跟上她的朋友们。,,,f7a92abb-0752-469f-bcc1-973a570bc21f
I can't put my finger on what's wrong with this plan.,我无法准确指出这个计划有什么问题。,,,71a994ec-1daa-4dfd-9cc6-01ead04972b9
She put her finger on the exact reason for the failure.,她准确指出了失败的确切原因。,,,2a208d27-3b97-434f-a6ac-c5488642e64c
We should hold off on making a decision until we have more information.,我们应该推迟做决定，直到获得更多信息。,,,dd3a1330-4c12-4163-8dbb-7c9b8864fcbf
He decided to hold off on buying a car until next year.,他决定推迟到明年再买车。,,,a21c5f5a-b7ba-4fbb-843c-b406b9756319
I'll have a whack at fixing the computer myself.,我会尝试自己修理电脑。,,,7208271f-beff-4fa5-976b-c90bb187dabd
Why don't you have a whack at solving this puzzle?,你为什么不尝试解决这个谜题？,,,25ca656b-d7bb-49e0-a516-ece4463d7c7f
I need to pump up the bicycle tires before we ride.,在我们骑车前，我需要给自行车轮胎打气。,,,912bb661-95d8-4d2e-8c6e-5685cf290306
Can you help me pump up the inflatable mattress?,你能帮我给充气床垫充气吗？,,,fea4a44e-02eb-47d0-9409-b16049d40c80
"The project has started, and we are making good progress.",项目已经开始，我们进展顺利。,,,02c1e124-5da0-41a7-bdf5-fd84d209e42a
I have started learning Spanish this year.,我今年已经开始学习西班牙语。,,,ae1a6b24-d6a5-4b55-9efb-907dbb8e6eff
